演出id,IF,count,指令代号,显示背景(string),人物出现,"人物立绘位置(默认0,左1,中2,右3)",人物消失,人物立绘效果(bool),立绘差分,对话者姓名,对话(选项)文本,特殊指令,音频播放(string),音频停止(string),赋值,GOTO 
2310,0,0,1001,山洞背景,0,0,0,0,0,0,在箱子里你找到了一个雕像的底座。,1002,0,0,2308,0
2310,0,0,1002,0,0,0,0,0,0,0,上面刻满了晦涩难懂的符文，还有一双断腿连接在底座的侧面。,1003,0,0,0,0
2310,0,0,1003,0,0,0,0,0,0,0,经过辨认，确定是要找的雕像底部。 ,1004,0,0,0,0
2310,0,0,1004,0,0,0,0,0,0,？？？,达贡，那个忠心耿耿的仆人，他也出卖了我吗？,1005,0,0,0,0
2310,0,0,1005,0,0,0,0,0,0,？？？,拉莱耶的每一寸土地都在我的感知之下，那些叛徒不可能随意混进来。,1006,0,0,0,0
2310,0,0,1006,0,0,0,0,0,0,？？？,究竟是祂们的分身已经强大到能欺骗我的感知，还是.........,1007,0,0,0,0
2310,0,0,1007,0,0,0,0,0,0,0,你环顾四周，发现这种声音是凭空出现在脑海里的。,1008,0,0,0,0
2310,0,0,1008,0,0,0,0,0,0,0,你观察雕像的断口，除了躯干应该还有一个头和底座。,-1,0,0,0,0
